timestamp,text
2019-05-27 11:49:06+00,Another Test tweet caught stream bitcoin
2019-05-27 11:49:22+00,Current Crypto Prices BTC 8721 99 USD ETH 266 62 USD LTC 114 03 USD BCH 432 02 USD XLM 0 133 USD DOGE 0 00314 USD NEO 12 04 USD XRP 0 4092 USD CANN 0 001482 USD EMC2 0 1198 USD XMR 94 65 USD BTG 24 31 USD
2019-05-27 11:49:23+00,Spiv Nosar Baz BITCOIN Is An Asset amp NOT A Currency
2019-05-27 11:49:25+00,We building real bitcoin SV What building broken BTC
2019-05-27 11:49:32+00,CHANGE IS COMING GET READY Boom Another CB Jab Nothing Can Stop This Globalism stage CB push make world govt coming The People Are Taking Lead amp Leaders Will Have Follow Majority WWG1WGQ
2019-05-27 11:49:19+00,One useful article Stefan guide run node Alibaba Cloud ltonetwork lto Eth xrpcommmunity crypto xlm xrp blockchain xrpcommmunity eos xmr trx ltc enjin ethereum bitcoin
2019-05-21 16:49:45+00,BTC IS STILL GOING STRONG Thus giving away 0 04 BTC 10 BNB 2 lucky winner GIVEAWAY double 250 RT To enter Follow u Subscribe RT airdrop bitcoin ico cryptocurrency xrp ETH TRX Binance ethereum btc crypto bounty
2019-05-22 12:42:16+00,BestMixer seized Dutch Police Luxembourg Police French Police w association Europol BestMixer Bitcoin Mixer Tumbler Cryptocurrency Bitcoin BestMixer
2019-05-10 14:06:01+00,share
2019-05-27 11:49:17+00,Countdown ComingSoon The QLC airdrop Q Gas token every QLC holder Don waste opportunity buy hold btc dent poa mco sky hot link btt trx gnt sys
2019-05-27 11:27:22+00,You roughly 6 day left get LaunhPadFoundation 50 50 raffle ticket Current around 16 5 Litecoin Head grab ticket today LTC BTC Crypto LitecoinFam airdrop DGB DigiByte
2019-05-27 08:32:08+00,BTC IS GOING CRAZYYY Thus giving away 0 04 BTC 10 BNB 2 lucky winner soon GIVEAWAY double 250 RT To enter Follow u Subscribe RT airdrop bitcoin ico cryptocurrency xrp ETH TRX Binance ethereum btc crypto bounty
2009-01-11 03:33:52+00,Running bitcoin
2019-05-02 17:36:29+00,cryptocurrency drife blockchain crypto eos eth ethereum btc cab taxi ride ride
2019-05-27 11:49:39+00,Crypto price rose across board weekend Bitcoin nears 9 000 level Trade Bitcoin Crypto Currencies AvaTrade today Trade Crypto Bitcoin XRP ETH XLM DASH Litecoin Blockchain 71 retail investor account lose money
2019-05-27 11:49:38+00,Bitcoin SV BSV Price Spikes 33 Gains 1 Billion From 55 Copyright Application CCN
2019-05-27 11:49:46+00,As Intel INTC Valuation Rose Btc Capital Management Has Increased 418 968 Its Position Schlumberger LTD SLB Share Price Declined While Mcdaniel Terry amp Co Cut 1 42 Million Its Holding
2019-05-27 11:49:47+00,This true Crypto currency new asset class people beginning understand I see fellow trader Moon
2019-05-27 11:49:48+00,If Bitcoin mean BSV I fully agree However talking BTC wrong Five year nobody even remember BTC
2019-05-27 11:51:01+00,Pls save cuttoff 60 65
2019-05-27 01:37:37+00,bitcoin may pump 100k I bet as 1DOGE 1BTC season
2019-05-27 11:49:40+00,How many sat person 3 million lost 18 mil 10 0 0018 BTC person 180k sat person Math answer question though would hodlers last resort account And thing like timelocked future lost coin etc
2019-05-27 07:00:46+00,Setelah Microsoft melacak biji kopinya Blockchain Starbucks perbincangan Bekerja Bakkt Starbucks Amerika Serikat menerima BTC alat pembayaran Sumber
2019-05-27 11:54:16+00,The Virgin Shitcoin pattern v Chad Bitcoin Pattern
2019-05-25 10:14:41+00,ohh incase anyone interested free BTC 9100 06 15 follow like retweet chance win amount increased 0 1btc 0 12 thanks phew
2019-05-27 11:49:54+00,Elections2019 Varanasi MondayMotivation JayeshbhaiJordaar Ahmadiyya bitcoin mondaythoughts Prabhas ModiInVaranasi Saaho Bharat MondayMorning Devi2In4Days ManojPahwa BharatWithFamily
2019-05-27 11:49:54+00,LTCprice surge ahead BTC quote user show interest LTCnetwork LTC Litecoin LTChalving top10coins
2019-05-26 21:33:37+00,BTC 8 700 10 500 semana
2019-05-27 11:45:48+00,It beginning
2019-05-27 11:49:59+00,Done Sell SRN BTC priced 0 018713 Bittrex
2019-05-27 11:50:00+00,I hope project interested large investment fund This platform deserves attention Experienced specialist working project KOI KOITOKEN Crypto Blockchain ethereum bitcoin ether cryptocurrency tokensale
2019-05-27 11:50:02+00,Spiv Nosar Baz BITCOIN Is An Asset amp NOT A Currency
2019-05-27 11:50:02+00,dash btc 0 0188 dash usd 161 87 btc usd 8720 85
2019-05-27 11:50:02+00,Top 5 cryptocurrencies Alert Time 2019 05 27 14 50 02 Bitcoin 8 706 712 Ethereum 266 511 XRP 0 409 BitcoinCash 432 692 Litecoin 113 525 btc xrp enigma JPY smartmoney
2019-05-27 11:50:03+00,A new content found Satoshi treasure Check thehuntison SatoshisTreasure bitcoin
2019-05-27 11:50:03+00,Great back bitcoin bandwagon 20 000 Soon When XRP 5 Soon xrp
2019-05-27 11:50:04+00,Bitcoin zet opmars voort klimt richting 9 000 dollar
2019-05-27 11:40:26+00,BTX BTX 1 11 28 29 create watchlist COIN360 BTX send mec MEC BSD BSD BTC
2019-05-27 11:50:04+00,Find best Cryptocurrency Bitcoin Affiliate Programs Forex Directory CryptocurrencyAffiliatePrograms CryptocurrencyAffiliateMarketing BitcoinAffiliatePrograms BitcoinAffiliateMarketing ForexDirectory
2019-05-23 14:14:21+00,Cresio Airdrop Alert MALTA AI amp BLOCKCHAIN SUMMIT 2019 btc bitcoin cresio cres trade trading signal airdrop bounty token ethereum xrp ripple multiexchange exchange cryptocurrency ico blockchain investor profit crypto
2019-05-27 11:50:05+00,VRPARK ICO TOKEN
2019-05-26 20:57:45+00,Bitcoin hit 12mth high sudden parabolic swing
2019-05-24 04:22:02+00,Will Jimmy Song lose 500K bet Joe Lubin 25 dApps 5k MAU already 4 year early The bet 5 dapps 10k user May 23 2023 If yes Jimmy pay Joe 810 8 ETH If Joe pay Jimmy 69 74 BTC v
2019-05-27 11:50:04+00,All user good
2019-05-27 11:50:09+00,channel called DGB made 6x share high reward low risk signal join BTC ETH ETC BCH LTC XRP DASH BTG XLM XMR ZEC ADA SNT NEO NXT OMG POWR VTC LUX XEM LSK DGB DOGE XVG GRS AMP ZCL DRGN DCR 76987
2019-05-27 11:50:12+00,My original point though response Dudas With BTC 8000 chance get rich I think important would BTC millionaire understand speculative asset gain lose value
2019-05-27 11:50:13+00,Bitcoin yukselcek kriptoya bulassam
2019-05-27 11:50:16+00,Does anyone URL website show much time needed confirm transaction bunch altcoins equivalent proof work Bitcoin confirmation I remember life
2019-05-27 11:50:18+00,Le Bitcoin ferme jamais
2019-05-27 08:59:29+00,BTCUSD 4H canal Telegram bitcoin btc criptoactivos criptomonedas criptotrading criptoinversion
2019-05-27 06:20:23+00,Well said This trying show tell guy Here given silver platter Good luck peep crypto bitcoin
2019-05-27 06:15:49+00,Bitcoin Posted CryptoParody Reddit
2019-05-10 09:59:45+00,dow Bitcoin imv
2019-05-10 10:03:54+00,Bitcoin FUDsters RN
2019-05-10 10:04:39+00,Banking Bitcoin Netflix
2019-05-26 19:58:37+00,No really This gaslighting bullshit The entire thread travesty Always question never settle know lot u try debate criticize learn improve without jerk
2019-05-27 01:57:40+00,Someone check Bitcoin seems coming back vengeance ever since blocked Bitcoin Twitter
2019-05-27 00:02:39+00,Keep eye prize bear got BTC
2019-05-27 11:50:24+00,15 Great Ways Absolute Beginners Learn About Bitcoin BTC News Aggregated By Crypto cryptocurrency Cryptonews
2019-05-27 11:50:28+00,Probably still Bitcoin Bought 300k dropped 2 3rds price leaving 100k Husband probably holding onto year going recover put back without ever telling
2019-05-27 11:50:29+00,Current Crypto Prices BTC 8718 83 USD ETH 266 54 USD LTC 114 02 USD BCH 432 01 USD XLM 0 1328 USD DOGE 0 003139 USD NEO 12 04 USD XRP 0 4091 USD CANN 0 001482 USD EMC2 0 1201 USD XMR 94 62 USD BTG 24 31 USD
2018-09-11 05:46:06+00,I didnt tether 7300 iamspartacus btc eth tusd ocn
2019-05-27 11:50:33+00,The latest The CryptoCoins Daily crypto bitcoin
2019-05-27 11:50:36+00,Just curious package BTC gift presentable way Giving ledger send BTC afterwards sound user friendly
2019-05-27 11:50:37+00,looking weekly candle gt
2019-05-27 11:50:39+00,wonder
2019-05-27 11:50:40+00,Omslagpunt nabij
2019-05-27 11:50:40+00,Bitcoin Climbs Highest Year Amid Cryptocurrency Comeback
2019-05-27 11:50:41+00,The latest BLOCKCHAIN amp DISTRIBUTED LEDGER Thanks Forum blockchain bitcoin
2019-05-10 18:40:43+00,kumbara
2019-05-10 14:18:33+00,Lfg
2019-05-10 14:41:06+00,great
2019-05-10 19:11:45+00,qkc btc
2019-05-10 22:14:34+00,nice
2019-05-11 00:12:46+00,1000 left
2019-05-27 04:26:49+00,Bitcoin price hit 150 billion market cap first time 2019 price pump 11 btc bitcoinprice pricesurge
2019-05-10 10:30:05+00,Nice projcet
2019-05-27 03:41:23+00,Get ready swell public medium interest Bitcoin price hit 10 000 Its psychological round number human conditioned peak interest btc crypto
2019-05-27 03:16:11+00,BIG Blockchain Intelligence Group announces acquisition Netcoins Operations entry Bitcoin Institutional OTC Trading Cryptocurrency Custody Services
2019-05-27 03:29:34+00,Thanks ruining 9k target guy
2019-05-27 11:50:46+00,Daily profit HODLING BTC since 2013 Data taken since 29 10 2018 10 45am UTC Updated every hour bitcoin btc cryptocurrency blockchain cryptotrade profit digitalmine
2019-05-27 11:50:49+00,nice project good Kwaza NST
2019-05-27 11:50:53+00,1 BTC 8704 59 9 36 2 ETH 266 60 7 3 3 XRP 0 41 7 21 4 BCH 433 53 9 03 5 LTC 113 55 12 85 6 EOS 6 95 10 36 7 BNB 34 35 1 75 8 USDT 1 01 0 47 9 XLM 0 13 6 2 10 ADA 0 09 7 95 blockchain crypto altcoin
2019-05-27 11:50:55+00,BTC X Robinhood Uses BitLicense Brings Zero Fee Crypto Trading New York
2019-05-27 11:50:55+00,578 020 Txs 1 Size 288 byte Stripped 288 byte Time 1558957844 Reward 12 5 BTC Fees 0 BTC Miner BTCcom Mempool 7 159 tx
2019-05-27 11:50:55+00,578 019 Txs 2 687 Size 1 16 MB Stripped 0 88 MB Time 1558957836 Reward 12 5 BTC Fees 1 15324107 BTC Miner AntPool Mempool 7 159 tx
2019-05-27 11:50:58+00,I liked project much
2019-05-27 11:50:49+00,It wonderful meeting along Shroff We great time discussing industry future trend technology bitcoin tech industry investment future futuretrends blockchain trend
2019-05-27 06:37:50+00,BTC Pullbacks likely short lived BTC found acceptance 8 300 multiple attempt So pullback likely recharge engine rise 9k
2019-05-27 07:01:02+00,USD lost 99 99 value bitcoin 2011 2019
2019-05-27 11:50:47+00,Follow Like Retweet investing investment finance investinyourself cryptocurrency crypto cryptotrading cryptomarket cryptonews forextrader coin bos btc bitcoin Airdrop bitcoin ox bitcoinox bitcoin bounty Ethereum freetoken freecoin follo4folloback
2019-05-20 17:07:49+00,We releasing information game token soon AioCasino AioToken AIO crypto bitcoin blockchain btc Casino Gambling ICO
2019-05-27 11:51:00+00,Praise Satoshi another 10 Bitcoin block found Be thankful EVERY Block Block 578020 Hash 000000000000000000178b495c00fd4def4bca1e0440fb3118d696b92bef3050
2019-05-27 11:51:01+00,kimcil
2019-05-27 11:51:01+00,The best class protocol insurance specially designed cryptocurrency mind More information visit inzura btc eth tokensale
2019-05-27 11:51:02+00,Bitcoin nears 9 000 break highest level year
2019-05-27 11:51:03+00,Mon May 27 13 50 44 2019 0 08 USD 8726 34 Wght 0 44 Blk 578020 Size 0 3 KB TXs 1 Pool 6890 3 6 MB 0 bitcoin
2019-05-27 11:51:06+00,Get best buy shopping spree jexpotz bitcoin
2019-05-27 11:51:09+00,duong dung duy loan tam anh tan tuyen
2019-05-27 11:51:11+00,Bitcoin Price Backs Off 12 Month Highs But Bias Remains Bullish CryptoToday
2019-05-27 03:03:38+00,Bitcoin hit time high Argentine peso via
2019-05-25 20:34:47+00,Bitcoin 8 000 generational opportunity create wealth family
2019-05-26 12:32:46+00,Over quarter Kraken employee get paid bitcoin
2019-05-27 11:51:14+00,Bitcoin designed make central control difficult possible maintain soundness falling inflation supply cap We know many dollar much gold Inflation vary wildly Must trust others That much worse early volatility imo
2019-05-27 11:51:14+00,Blog Right Yes Bitcoin full node need full history operate due UTXO nature You need node XRP ledger That much faster spin sync node XRP Ledger
2019-05-27 11:51:15+00,Bitcoin Holds onto Gains Rises Above 8 600
2019-05-27 10:54:21+00,ETH reaching potential bounce area BTC pair Overall favourite chart btc atm
2019-05-27 11:51:19+00,Success blockchain cryptocurrency bitcoin ethereum ICO P2PS P2PSF startup
2019-05-27 11:51:22+00,bitcoin Holds onto Gains Rises Above 8 600
2019-05-27 11:12:02+00,Indicator giving rare top signal H1 funding sentiment suggests may forming top Not confident 9 6k target anymore Closing Bitcoin longs evaluating
2019-05-27 11:51:23+00,Crypto comeback omslagpunt dichtbij
2019-05-27 11:51:27+00,D I V O R C E
2019-05-27 11:51:28+00,This great explanation rsr
2019-05-27 11:51:29+00,39 Cryptocurrency Hacks 1 93 Billion Loss Over 5 Years MEDICIresearch Bitcoin cryptocurrencies Hacks blockhain
2019-05-27 11:51:34+00,Well even anonymous bitcoin cash machine Europe
2019-05-27 11:51:37+00,Current Crypto Prices BTC 8716 59 USD ETH 266 32 USD LTC 113 84 USD BCH 432 15 USD XLM 0 1328 USD DOGE 0 003051 USD NEO 12 04 USD XRP 0 4089 USD CANN 0 001481 USD EMC2 0 12 USD XMR 94 65 USD BTG 24 31 USD
2019-05-27 11:51:39+00,Estoy pendiente
2019-05-27 11:51:41+00,blockchain cryptocurrency bitcoin ethereum ICO P2PS P2PSF startup
2019-05-27 12:02:52+00,
2019-05-27 11:51:44+00,They still call everything bitcoin shitcoin wish loss altcoin holder call everything bitcoin completely worthless It elitist toxic The fact call others retard tuur meester liking tweet show exactly toxic
2019-05-27 11:51:45+00,2nd round 1000T free BTC hashrate giveaway follow twitter amp invite friend follow BTC hashrate
2019-05-27 11:51:48+00,VC crypto BTC waste literally 0 alt succeed Yes speculate hot new rip 100x long run wasting economic enery essentially big hyped roulette wheel
2019-05-27 10:55:37+00,Topmuntje Bitcoin
2019-05-27 12:03:55+00,I since 2013 Bought boatload btc 150
2019-05-27 12:06:33+00,blockchain cryptocurrency bitcoin ethereum ICO P2PS P2PSF startup
2019-05-10 10:04:52+00,QKC Blockchain BTC ETH blockchaintechnology sharding
2019-05-10 10:12:18+00,QuarkChain QKC BTC
2019-05-11 06:53:18+00,Never late buy The best timing buy BTC ten year ago
2019-05-27 11:51:40+00,It happened Could 10k next bitcoin
2019-05-15 22:26:29+00,Free 100 BTM worth 24 Airdrop community We distributing Airdrop first 5 000 user freely SelfDrop go live Register u login click Get Airdrop link blockchain BTM bitcoin token ethereum Ripple
2019-05-27 12:02:26+00,Look current bitmex BTC ETH funding rate lol
2019-05-27 00:34:18+00,Bitcoin nears 9 000 break highest level year CNBC
2019-05-27 11:51:48+00,Block Number 578 020 Time 5 27 2019 11 50 44 AM UTC Miner Unknown Transactions 1 Block Value 12 5 BTC Size 288 byte Total Supply 17 725 250 84 40595 BTC issued Price 8763 79
2019-05-27 11:51:48+00,Block Number 578 019 Time 5 27 2019 11 50 36 AM UTC Miner AntPool Transactions 2 687 Block Value 7 498 375 BTC Size 1 216 952 byte Total Supply 17 725 237 5 84 40589 BTC issued Price 8763 79
2019-05-27 11:51:55+00,bitcoin xrp vechain blockchain Crypto Cryptocurency xrp Celtic
2019-05-27 11:51:56+00,nice project good Kwaza NST
2019-05-27 11:51:56+00,BTC LTC XRP Top 6 cryptocurrencies manipulated 26May 2019 7pm 9pm see Tradingview chart NOT subtle
2019-05-27 11:51:57+00,Advisor
2019-05-27 11:51:58+00,ETERBASE first regulation compliant European cryptocurrency exchange offering fast secure trading clean powerful user interface Fore information visit bitcoin exchange
2019-05-27 11:52:01+00,btc bitcoin exchange Binance
2019-05-27 11:52:01+00,May 26 27 good day Bitcoin Supreme BSPM 1 33 increase
2019-05-27 11:52:03+00,PriceAnalysis BitcoinGold might witness good day near future CryptoNewsZ Cryptocurrency BTG
2019-05-27 11:52:03+00,Art Trading Trading GOLD bitcoin
2019-05-27 11:52:03+00,Can 10 000 brain AI called Rose predict price Bitcoin
2019-05-27 11:52:03+00,Bitcoin zet opmars voort klimt richting 9 000 dollar
2019-05-27 11:52:02+00,New post Top 3 Price Prediction Bitcoin Ripple Ethereum BTC USD struggle maintain newly conquered
2019-05-27 08:58:46+00,The Top 5 Countries Gripped Bitcoin FOMO Right Now
2019-05-27 11:52:05+00,Bitcoin Surges Highest Price For Over Year Will Reach 10k This Week Coinbase cryptocurrency crypto Blockchain BTC bitcoin BTCUSDT eth
2019-05-27 11:52:03+00,Followback 24h U S woman ready World Cup IFB ETH BTC Crypto
2019-05-27 11:52:05+00,Followback 24h Pagenaud hold Rossi win 103rd Indy 500 IFB ETH BTC Crypto
2019-05-27 11:52:07+00,bitcoin community
2019-05-27 11:52:11+00,cryptocurrencies crypto altcoins cryptotrading BTC blockchain Angel Crypto Investor Roger Ver Lightning Network Supporter Tone Vays A Look Debate
2019-05-27 11:52:15+00,Bitcoin ETH Iota Brave EL FUTURO
2019-05-27 11:52:15+00,af76
2019-05-27 11:52:16+00,PC infected RAT person tried gain access account FRAUD ID banned account seller 0 1 BTC bond support answering user LinusTech King
2019-05-27 11:52:17+00,Check article Chain QKC Blockchain BTC blockchaintechnology sharding
2019-05-27 11:52:07+00,The latest The Patrick Allan Daily Thanks bitcoin cdnpoli
2019-05-25 23:26:58+00,Analysts closely watching relatively tight range 8 200 8 400 next region resistance BTC must close order journey towards coveted 10 000 region continue
2019-05-27 11:29:02+00,please welcome summertime visiting Tassie think warm Melbourne Show hot bitcoin
2019-05-27 01:09:46+00,Bitcoin litecoin dominating Do know Simple really Litecoin halving 3 month Bitcoin halving 12 month HODL BTFDs ltc litecoin bitcoin btc
2019-05-27 11:52:05+00,Here next level buy BTC
2019-05-27 11:52:20+00,
2019-05-27 11:52:20+00,I pay btc hahaha
2019-05-27 11:52:20+00,blockchain cryptocurrency bitcoin ethereum ICO P2PS P2PSF startup
2019-05-27 11:52:24+00,Successful anf hoppefully smoothly project proud able pparticipate project Very good project ooobtc obx crypto bitcoin ethereum blockchain btc toqqn
2019-05-27 11:52:24+00,ETH BTC P2PS
2019-05-27 11:52:25+00,aulian 0xfc9219Afb2D0aFC82924cCf08152c62a2EeC0878
2019-05-27 11:52:28+00,Bitcoin price prediction BTC USD consolidates gain Bitcoin confluence
2019-05-27 11:52:28+00,bitcoin 150 B market cap 8 700 Dr could chance changed view bitcoin
2019-05-27 11:52:28+00,And Bitcoin madness back touch 8900 How many speculator ready burn hand But wait drop back 4k Crypto Investment Speculation Bitcoinmania bubble nointrinsicvalue regulation
2019-05-27 12:05:07+00,
2019-05-26 22:27:19+00,Who need Bitcoin triangle meme When another CME BTC Futures gap meme 520
2019-05-13 16:30:27+00,The last time Bitcoin broke 8 000 Microsoft building Congress fighting Bakkt launching Square selling Fidelity storing TD Ameritrade trading Whole Foods accepting
2019-05-23 16:18:55+00,Them Listen I acclaimed economist Them Listen I billionaire investor Them Listen I central bank Them Listen I judge Them Listen I Satoshi Bitcoin
2019-05-10 10:25:15+00,Nice
2019-05-26 13:30:05+00,Ads Bitcoin Please wait 4 day 2 95 transaction Uber Please enjoy ride rapist go bankrupt Airbnb Please enjoy stay mind camera bathroom
2019-05-26 21:58:57+00,Cryptos Are Exploding Higher Bitcoin At 12 Month Highs
2019-05-27 11:52:36+00,cool project
2019-05-27 11:52:39+00,The Situation Complicates For Cryptopia As Arizona Demands 2 ethereum btc altcoins User Database
2019-05-27 11:52:44+00,Current Crypto Prices BTC 8718 66 USD ETH 266 3 USD LTC 113 9 USD BCH 432 4 USD XLM 0 1329 USD DOGE 0 003052 USD NEO 12 04 USD XRP 0 4092 USD CANN 0 001482 USD EMC2 0 12 USD XMR 94 61 USD BTG 24 31 USD
2019-05-27 07:34:58+00,Coinbase iOS app downloads spiked Memorial Day weekend US BTC ETH crypto
2019-05-27 11:28:01+00,Gold v Fiat v Bitcoin source
2019-05-27 11:02:10+00,TraderCobb Why I think Bitcoin Will Get To 10 000 This Week I observing Bitcoin closely last 2 week far stuck I thought might Get understanding I think chance 10k w crypto
2019-05-26 04:25:51+00,BTC
2019-05-26 21:56:26+00,We giving away 100 000 AWE lucky winner 24 hour To enter 1 Retweet pinned post 2 Follow Ends 22 00 UTC Monday Crypto cryptocurrency bitcoin btc win Competition ethereum free Competition Giveaway
2019-05-26 13:40:09+00,Bitcoin free speech money everyone Fiat free beer money one money printer Choose wisely
2019-05-27 03:50:33+00,BTT listed trade BTT BTC 12 00 May 29 2019 SGT
2019-05-27 11:52:48+00,Blockrewards increased 50 ULG Make nice profit ULG masternode Dont miss opportunity blockchain Business investment bitcoin money freelancer earnings BTS collector freelancewriter BTCUSDT
2019-05-27 11:52:48+00,Buy Gold sell BTC
2019-05-27 11:52:55+00,YZ So youre saying Bitcoin reach certain price Bitcoin back enough dollar circulation sufficient fuel world economy But BTC reserve currency I would think value would denominated BTC USD
2019-05-27 11:52:56+00,LTC Price Spikes 12 Percent Litecoin Usage Rises Along Transactio bitcoin altcoins altcoin
2019-05-27 11:53:00+00,Fair Go Casino 25 Free Spins All Players Monday Bonus 100 25 Reliable Crypto Bitcoin Casino Australia France USA country
2019-05-27 11:53:00+00,Ultimately I think concern authority The fact market low liquidity capital relatively simple flex make bank ALTs largely pointless except making BTC
2019-05-10 20:34:39+00,BTC
2019-05-27 10:41:47+00,Which price range bitcoin trading week
2019-05-10 10:15:12+00,Blockchain BTC ETH blockchaintechnology sharding
2019-05-10 10:16:05+00,Blockchain BTC ETH blockchaintechnology sharding
2019-05-10 10:30:12+00,I love lol
2019-05-10 14:41:39+00,BTC
2019-05-27 06:09:02+00,ETH could following BTC well first week June possible big breakout
2019-05-27 11:53:03+00,Boys look like need dump ALTS buy back BTC look
2019-05-27 11:53:04+00,Free airdrop 50 coin cpol earn 0 1 eth Sing gooo link classic XRP1
2019-05-27 11:53:06+00,Wow Making bitcoin online easy Check Incredible
2019-05-27 08:22:55+00,Next indicator I waiting cross Weekly Bitcoin
2019-05-27 11:53:10+00,bitcoin 9 000 making everything possible COINBASE BTCUSD CryptoComes
2019-05-27 11:53:12+00,Lucky One bitcoin blockchain Someone put empty block And get reward Block height 578020 See
2019-05-27 11:53:18+00,Great weekend Silverstone FIA World Rallycross Championship
2019-05-27 11:53:20+00,Effortless Bitcoin effortless convert fiat goal merchant trade woman billion I counted woman tell u
2019-05-27 11:53:21+00,New Exchange For registration get gift 500 COIN AMPX This currency special platform priced starting open platform 1 giveaway freecoins free Airdrops coin Bounty bitcoin blockchain freetoken
2019-05-15 13:35:01+00,1 2 well I another giveaway amount still sitting I know people point first wanted clear cross 8100 April 19 much resistance I know hence chosen BUT let give see thread
2019-05-27 11:53:40+00,Precio actual Bitcoin BTC U S 8717 23
2019-05-26 09:34:55+00,seul vote utile bitcoin
2019-05-27 09:52:10+00,Something Happening EXU EXUprotocol EXUecosystem BTC ETH Blockchain Crypto Cryptocurrency decentralization
2019-05-27 11:53:23+00,Come jcho grow pair Bitcoin going 100 right If gift short 4 7k entry 2X even better Tell risk nanny prop house fuck keep layering short way 20k Do money must
2019-05-27 11:53:26+00,QuarkChain QKC Blockchain BTC ETH blockchaintechnology sharding
2019-05-27 11:53:29+00,COINCHAT safest digital wallet officially published The first 10 000 new user win candy lucky bag BTC amp ETH Send invitation friend candy bag Click receive
2019-05-27 11:53:34+00,blockchain cryptocurrency bitcoin ethereum ICO P2PS P2PSF startup
2019-05-27 11:53:34+00,WildRig Multi 0 17 1 Beta AMD GPU Miner With Support New X25x Algorithm BTC market blockchain
2019-05-27 11:53:37+00,Why everyone bear badly btc
2019-05-27 11:37:11+00,This banking system really corrupt AF Flagrantly sickeningly despicably ripping people business around world Yet leader pocket audacity call Bitcoin scam Pump Bitcoin Dump bank
2019-05-26 13:30:50+00,New video Overview trade strategy Binance IEOs coin listing What watch plan trading buying IEOs The video discus BTC TFUEL MATIC amp ONE Feel free share like subscribe thanks
2019-05-27 11:53:44+00,BTC BCH The HitBTC cryptocurrency exchange deal backlash froze account fear mass exodus accused John McAfee Read
2019-05-27 11:53:45+00,Market Surveillance May 27 BTC Up By Nearly 10 As 11 10 UTC May 27 gl
2019-05-27 11:53:48+00,BTC TRX Bitcoin BTC king cryptocurrency market witnessed significant hike breached 8500 mark This resulted entire cryptocurr Read
2019-05-27 11:53:49+00,Mwikali PC infected RAT person tried gain access account FRAUD ID banned account seller 0 1 BTC bond support answering user LinusTech King
2019-05-27 11:53:49+00,BTC Craig Wright written long winding statement alleging Bitcoin developer changing original rule Bitcoin blockchain Read
2019-05-27 11:53:52+00,BTC BCH A growing number NFL player paid crypto Read
2019-05-27 11:53:52+00,Current Crypto Prices BTC 8718 73 USD ETH 266 18 USD LTC 113 84 USD BCH 432 06 USD XLM 0 1328 USD DOGE 0 003139 USD NEO 12 04 USD XRP 0 409 USD CANN 0 001482 USD EMC2 0 1201 USD XMR 94 61 USD BTG 24 31 USD
2019-05-27 11:53:54+00,Maneh madman ceukaingoge p
2019-05-27 11:53:54+00,0 01 BTC Change 100 BTC Join CFI HMQ CRW VOX BCY ABY SIB NMR XAUR VTR TRUST PKB GRS SNGLS GBG SHIFT DRACO SWT MUSIC EXP MYST GNO IOC TKS MUE BLOCK ICX BLZ TRX VEN BNB NANO HSR DGD CTR AE MTL YOYO PPT LEND VIBE
2019-05-27 11:53:54+00,FIRST 100 MEMBERS WILL BE ALLOWED Join BTC ETH NEO XLM XRP ADA EMC2 OMG BCC VTC AEON GVT FUEL LINK APPC MOD NEBL LEND BQX ARN ENJ INS REQ AMB OAX REQ VIBE ICN TNT MTH CMT
2019-05-27 11:53:55+00,Free cloud mining cryptocurrency Works since 2013 Bitcoin Ethereum Litecoin Bitcoin Cash Dogecoin Ripple Dash Cardano CureCoin NEM Monero Zcash Factom Bytecoin STEEM Lisk EOS USD Stellar GRIN Ethereum Classic 798 Sign Up
