timestamp,text
2019-05-27 11:53:57+00,Long Short BTC 100xx leverage Bitmex
2019-05-27 12:02:42+00,Et
2019-05-27 11:58:43+00,blockchain cryptocurrency bitcoin ethereum ICO P2PS P2PSF startup
2019-05-10 10:25:25+00,btc usd p
2019-05-27 11:43:43+00,bitcoin zoomed daily update last flag post broken
2019-05-26 19:00:08+00,Forget trading system In crypto bull market hodler outperform trader BTC HOT LINK BNB RVN THETA SCRL bag ZIL BAT TOMO good choice Remember still get actually make profit
2019-05-26 11:46:22+00,living legend BTC v USD
2019-05-27 11:53:59+00,Buy bitcoin buy xrp
2019-05-27 11:54:01+00,So saying Bitcoin forked
2019-05-27 11:54:01+00,ethereum classic yahoo finance sell ethereum
2019-05-27 11:54:03+00,Bitcoin price prediction BTC price primed small correction could evolve major correction
2019-05-27 11:54:04+00,NA WE BO NAAAA
2019-05-27 11:54:11+00,aulian 0xfc9219Afb2D0aFC82924cCf08152c62a2EeC0878 airdrop bounty eth btc crypto blockchain giveaway
2019-05-27 11:54:08+00,FiatChrysler bitcoin coming Report join CH 167
2019-05-26 10:15:30+00,Fidelity Is Really In Love With Bitcoin Texas Office Filled With Crypto ASICs
2019-05-11 01:00:33+00,
2019-05-27 06:53:59+00,AITA wanting divorce husband lost 200k bitcoin
2019-05-27 11:54:17+00,Longer term support resistance Bitcoin BTC
2019-05-27 11:54:22+00,Can Blockchain Change How We Compute Credit Scores bitcoin blockchain creditscore
2019-05-27 11:54:25+00,FIRST 100 MEMBERS WILL BE ALLOWED Join CFI HMQ CRW VOX BCY ABY SIB NMR XAUR VTR TRUST PKB GRS SNGLS GBG SHIFT DRACO SWT MUSIC EXP MYST GNO IOC TKS MUE BLOCK BTC ETH CBC OCN PRO BLT NGC AID DMT POLY LRC TUSD
2019-05-10 10:19:35+00,Where bitcoin sign guy need
2019-05-27 11:54:26+00,Bitwise Bitcoin Spot Market Is Significantly Smaller And Significantly More Efficient Today
2019-05-27 11:54:27+00,Litecoin Is Suddenly Rocketing Boosting Bitcoin Ethereum And EOS Here Why Cryptocurency Litecoin Bitcoin ethereum EOS investing
2019-05-27 11:54:29+00,If went month would considered Genius said bitcoin bad investment
2019-05-27 11:54:29+00,Paxful PC infected RAT person tried gain access account FRAUD ID banned account seller 0 1 BTC bond support answering user LinusTech King
2019-05-27 11:54:32+00,ETH weaker right chance wick 265 Mex BTC hold
2019-05-27 11:54:34+00,Let learn The Amon Artificial Intelligence system chooses best digital asset based maximum value card holder moment purchase amon xrp bitcoin Eth xrpcommmunity xlm crypto eos xmr trx ltc cryptocurrency bnb enjin matic btt bch AI
2019-05-26 21:56:06+00,As block 577 920 84 4 BTC mined Only 3 276 000 BTC left
2019-05-17 01:52:29+00,Retweet And Tweet pinned post tag 5 friend Airdrop DogCash Has begun For user 1500 DOG Token 150 Invite friend 30 DOG Token 3 Join Now Airdrop Visit official site Airdrop DogCash DOG airdrop BTC ETH
2019-05-27 12:01:01+00,blockchain cryptocurrency bitcoin ethereum ico P2PS P2PSF startup fintech
2019-05-27 11:54:38+00,The bitcoin driver got strategy rekt They seem decided give chance short term trader accumulating bitcoin LoL
2019-05-27 11:54:38+00,I buy ALTS keep BTC largest holding
2019-05-27 11:54:38+00,01 EOS scale BTC soon know else well
2019-05-27 11:54:38+00,Join telegram channel let help 16282577264 financialfreedom entrepreneurship hustle Realestate investment investor workfromhome motivation residualincome grantcardone realestateagent investmentproperty investing bitcoin blockchain binary
2019-05-27 11:54:39+00,blockchain cryptocurrency bitcoin ethereum ICO P2PS P2PSF startup
2019-05-27 11:54:42+00,How comment
2019-05-27 11:54:44+00,PC infected RAT person tried gain access account FRAUD ID banned account seller 0 1 BTC bond support answering user LinusTech King
2019-05-27 11:54:47+00,good
2019-05-27 11:54:49+00,Why people trading btc Obviously fiat
2019-05-27 11:54:50+00,Blockchain BTC ETH blockchaintechnology sharding
2019-05-27 11:54:53+00,HOT top 10
2019-05-27 11:54:53+00,This posted 5 year ago time traveler bitcoin hit 100 000 year maybe doomed
2019-05-17 12:32:48+00,We Pre Sale Final chance earn extra token launch ICO Get 10 Pre Sale Bonus May 31st 2019 privatesale ico vimee vimx vimeetoken MadeInIndonesia cryptocurrency Indonesia muslimcrypto shariahcrypto btc cryptotrading eth xlm
2019-05-27 10:42:00+00,See latest update slatecurrency github blockchain btc eth disruptive decentralized ico dash masternodes entertainment streaming
2019-05-27 11:54:59+00,mondaythoughts bitcoin godmc EuropeanElectionResults Dubbed Jewel airport park complex feature forest park walking trail seven storey waterfall 45 000 litre water cascade minute Safdie Architects
2019-05-27 11:55:02+00,bitcoin mining erfahrung Binance
2019-05-27 11:55:02+00,Bitcoin crypto currency signal highest profit 1 200 pip
2019-05-27 11:55:04+00,Bitcoin Casinos Actually Thing BitcoinCasinos Gambling CasinoGambling BitcoinGambling via Computers
2019-05-27 11:55:06+00,Women stay complicit woman choses whim destroy fun I always supported woman TwitterBlackout bitcoin MeToo
2019-05-27 11:55:07+00,Bitcoin Surges Highest Price For Over Year Will Reach 10k This Week
2019-05-27 11:55:08+00,Bitcoin layered experience evolve feedback loop help transcend current layer understanding Regardless layer find always new layer discover
2019-05-27 11:55:08+00,What Bitcoin straight give damn get everyone disbelief REKT While slowly gradually climbing 30 000
2019-05-27 11:55:09+00,Current Crypto Prices BTC 8719 76 USD ETH 266 23 USD LTC 113 89 USD BCH 432 58 USD XLM 0 133 USD DOGE 0 003139 USD NEO 12 04 USD XRP 0 4092 USD CANN 0 001482 USD EMC2 0 1201 USD XMR 94 63 USD BTG 24 29 USD
2019-05-27 05:37:08+00,Unpopular opinion Bitcoin Maximalists hate altcoins greed previously caused lose fund buying top
2019-05-26 21:38:54+00,OBV Binance BTC USDT Nothing strange
2019-05-10 10:21:08+00,BTC
2019-05-10 10:21:34+00,CoinMarketCap CoinMarketCap
2019-05-17 09:48:31+00,DAPS outperform already established Privacy Coins Have coffee read whitepaper follow DAPS promofriday blockchain ETH BTC ESC2019 Eurovision
2019-05-27 11:02:17+00,Bitcoin retreated 12 month high 8 900 hit earlier today price holding well key support 8 390 Report
2019-05-27 11:55:09+00,5 Cryptocurrency Tax Questions Asked April 15th More Crypto Tax CapitalGains Safety Bitcoin News Tips CryptoTips CryptoTaxHelp CTH HMRC NewYear Invest RT Tax InlandRevenue
2019-05-27 11:55:10+00,What preferred way stacksats Btc bitcoin bnb cryptotwitter crypto Binance MondayMotivaton
2019-05-27 11:55:10+00,THE BITCOIN BREAKOUT 11 800 Target Monthly Bull Market Bitcoin Price Analysis Today bitcoin bitcoins bitcoinprice bitcoinnews bitcointrading
2019-05-27 11:55:11+00,Bitcoin Near 9 000 Chilling Innovation One Dollar Or 1 BTC amp TRON BitTorrent Announcement bitcoin bitcoins bitcoinprice bitcoinnews bitcointrading
2019-05-27 11:55:11+00,It bet Competition Bitcoin literary community sometimes get nasty
2019-05-27 11:55:14+00,DTA BTC Accounting firm Grant Thornton LLC May 27 2019 provided update regarding petition bankruptcy filed defunct cryptocurrency exchan Read
2019-05-27 11:55:19+00,BITCOIN change people It unmask SORRYBITCOIN
2019-05-27 11:55:20+00,Read Free Blockchain The Ultimate Guide To Mastering Bitcoin Ethereum amp Other Cryptocurrencies Smart Contracts Dapps Investing Mining Litecoin Ripple Putincoin etc gt
2019-05-27 11:55:21+00,Currently round 7989 64 100 participant 0 10710974 BTC
2019-05-27 11:55:21+00,Gain node OPCX Partage gt Valeur monnaie 27 00 gt Valeur Btc 0 00000378 Gain node MGB Partage gt Valeur monnaie 4 59 gt Valeur Btc 0 00000016 EasyNODESBtc
2019-05-27 11:55:22+00,Bitwise Bitcoin Spot Market Is Significantly Smaller And Significantly More Efficient Today
2019-05-27 11:55:24+00,blockchain cryptocurrency bitcoin ethereum ICO P2PS P2PSF startup
2019-05-27 11:55:24+00,KOI KOITOKEN Crypto Blockchain ethereum bitcoin ether cryptocurrency tokensale
2019-05-27 11:55:25+00,Agreed need 50k BTC 5 Sat ETN Altcoins seeing even bigger gain BTC excuse Altcoins well used anymore ETN either hold right got Knocked Fuck Out lol
2019-05-26 23:01:01+00,Bitcoin Price Surpasses 8 600 Big Overnight Rally Investor Eyes 28K
2019-05-26 15:40:00+00,GAMBproject Ahead milestone plan Decentralization Blockchain ecommerce eth btc marketplace disruptive GMB GAMB
2019-05-27 11:55:35+00,The latest FISH FARM NEWS AND ARTICLES trump bitcoin
2019-05-27 11:55:37+00,This pleb really thought I said rap 6 I saying btc 6k What muppet
2019-05-27 11:55:38+00,Bitcoin price prediction BTC price primed small correction could evolve major correction
2019-05-27 11:55:40+00,Drife IEO Crypto Blockchain ethereum bitcoin ether cryptocurrency tokensale
2019-05-27 11:55:41+00,blockchain cryptocurrency bitcoin ethereum ICO P2PS P2PSF startup
2019-05-10 12:19:40+00,kumbara
2019-05-27 11:55:45+00,Always fun seeing Tom Good week Asian Leadership Conference korea btc nears 10k Catching next stellar conference coming w Dem Ted
2019-05-27 11:55:48+00,parker
2019-05-27 11:55:50+00,Awesome Project blockchain cryptocurrency bitcoin ethereum ICO P2PS P2PSF startup
2019-05-27 11:55:53+00,Bitcoin price prediction BTC USD consolidates gain Bitcoin confluence
2019-05-27 11:55:55+00,Beacon Chain Update Buterin Proposes Changes Ether blockchain bitcoin altcoins Vitalik Buterin
2019-05-17 08:17:35+00,Neutral Dollar NUSD available KuCoin deposit Supported trading pair include BTC NUSD USDT NUSD Trading start May 20 2019 18 00 UTC 8 withdrawal open May 22 2019 18 00 UTC 8 project KCS NUSD BTC USDT
2019-05-27 11:58:12+00,A gradual push towards 10k
2019-05-27 11:58:12+00,Join giveaway chance win cryptocurrencies mining hardware By Check giveaway Competition win cryptocurrency crypto bitcoin
2019-05-27 11:55:46+00,Paycent open robust cryptocurrency eco system individual business thanks diverse platform The Paycent wallet hold Bitcoin BTC Litecoin LTC Ethereum ETH DASH Binance Coin BNB Steem coin The Paycent Card used withdraw cash
2019-05-27 05:19:30+00,Wow btc Bitcoin
2019-05-27 11:55:58+00,LOLTOKEN Crypto Cyptocurrency Currency Ethereum Bitcoin Litecoin Trading Investment Btc Eth The lol undertaking admirable chore still many position world many people neither reaed draft
2019-05-27 11:56:00+00,Nice Project blockchain cryptocurrency bitcoin ethereum ICO P2PS P2PSF startup
2019-05-27 11:56:01+00,O valor Bitcoin caiu R 34400
2019-05-27 11:56:02+00,New Bitcoin Twitter Account Impressions Bitcoin
2019-05-27 11:56:03+00,HODL Proves Itself This Man Had Lost Almost 50 BTC From HODLing Altcoins Since 2017 cryptocurrency altcoins eth bitcoinnews binance trading tron
2019-05-27 11:56:05+00,New post Top 3 Price Prediction Bitcoin Ripple Ethereum BTC USD struggle maintain newly conquered territory
2019-05-27 11:56:09+00,Bitcoin zet opmars voort klimt richting 9 000 dollar Economie ZZP Ondernemer
2019-05-21 23:40:10+00,Multiply Bitcoin Ethereum
2019-05-10 10:06:01+00,index fund bitcoin current worth
2019-05-27 02:10:25+00,Posted
2019-05-27 05:59:41+00,Remember everyone told touch Bitcoin Because currently best investment world
2019-05-27 11:56:13+00,
2019-05-27 11:56:14+00,BTC Bitcoin Crypto CraigWrightIsAFraud CalvinAyreIsAPedophile Faketoshi
2019-05-27 11:56:15+00,Bitcoin nimmt rasant fahrt
2019-05-27 11:56:15+00,BitTeam BTT tokensale P2P exchange Marketplace CDC crypto blockchain ICO cryptocurrency bitcoin
2019-05-27 11:56:16+00,Current Crypto Prices BTC 8721 01 USD ETH 266 24 USD LTC 113 9 USD BCH 432 75 USD XLM 0 1329 USD DOGE 0 003139 USD NEO 12 03 USD XRP 0 4091 USD CANN 0 001482 USD EMC2 0 1191 USD XMR 94 63 USD BTG 24 37 USD
2019-05-27 11:56:19+00,like except legend part
2019-05-27 11:56:21+00,harga Btc semalam rm33k wow rm36k
2019-05-27 11:56:24+00,I hope project interested large investment fund This platform deserves attention Experienced specialist working project Drife IEO Crypto Blockchain ethereum bitcoin ether tokensale official
2019-05-27 11:56:04+00,It happening world NATIONS taking back country Vote PEOPLES PARTY OF CANADA Canada next
2019-05-26 18:50:03+00,Zilliqa Contest Day 10 Zilliqa tool needed create better tomorrow blockchain time blockchain world took notice blockchain crypto cryptocurrency zilliqa ZilliqaDay2019 bitcoin technologytrends
2019-05-27 02:26:25+00,Bitcoin Cash Privacy Has Improved Leaps Bounds
2019-05-27 06:54:40+00,Bitcoin like big liquidity sump Think black hole sucking money sloshing around This keep economist whose job keep bloated economy going awake night
2019-05-27 11:56:30+00,Bitcoin Surges Highest Price For Over Year Will Reach 10k This Week
2019-05-27 11:56:31+00,Great Analysis crypto currency Channel join gt BTC XRP LTC ETH ADA XLM XVG TRX OCN IOST NCASH STORM EOS NEO IOTA CDT DASH XEM VEN ETC GVT LISK OMG APPC MOD NEBL ENJ 32
2019-05-27 11:56:33+00,Universal Aid Fund investment project dealing mining trading Payment Proof Universal Aid Fund telegram btc bitfinex mining bitcoin btcevipminings binance bittrex btcusd
2019-05-27 11:55:30+00,Binance volume crypto exchange Register EMC SMART POE RLC HT ENJ BNB DTR GTO GAME GTC CPX ZCL SRN ABT BIX MTL MANA Bitcoin Blockchain trading chart TA ico altcoins trade ELA MKR BTS XHV CELR FET
2019-05-27 11:56:34+00,578 021 Txs 2 640 Size 1 08 MB Stripped 0 91 MB Time 1558958180 Reward 12 5 BTC Fees 0 97819847 BTC Miner F2Pool Mempool 6 527 tx
2019-05-27 11:56:34+00,Mon May 27 13 56 20 2019 5 36 USD 8726 65 Wght 0 44 Blk 578021 Size 1110 2 KB TXs 2640 Pool 6206 3 3 MB bitcoin
2019-05-27 11:56:37+00,mhsni zahra
2019-05-27 11:56:39+00,PC infected RAT person tried gain access account FRAUD ID banned account seller 0 1 BTC bond 500 positive support answering user LinusTech King
2019-05-11 01:00:47+00,
2019-05-19 13:03:07+00,1st June around corner Hard Launch Moon Fortune coin payment affiliate program For rundown prepared visit playloteo hardlaunch blockchainlottery Bitcoin ethereum lotes loteu eth btc
2019-05-23 06:44:47+00,Get unlimit faucet everyday gambling btc game luckyfish via
2019-05-11 13:57:42+00,I see
2019-05-27 08:07:38+00,We excited announce Ocean Protocol OCEAN listed KuCoin Supported trading pair include OCEAN BTC OCEAN ETH deposit start
2019-05-27 11:56:44+00,Good news The number user invest growing ICO best way invest harmonyprotocol deepsharding blockchain BUIDL BTC ETH
2019-05-27 11:56:54+00,Bitcoin price analysis BTC bull get ready breakthrough 9 000
2019-05-27 07:02:08+00,
2019-05-27 11:56:58+00,awesome video Also look Volume Profile TPO
2019-05-27 11:56:58+00,
2019-05-27 11:56:59+00,Bitcoin BTC Whales Making Splash Did 9 Transactions Valued 236m Spark Market via
2019-05-27 11:57:02+00,ir
2019-05-27 11:57:03+00,Bitcoin hit time high Argentine peso
2019-05-27 11:57:04+00,accurate
2019-05-27 11:57:04+00,Public Perceptions Bitcoin Spot Market Are Wrong Says Bitwise CoinDesk
2019-05-26 18:32:52+00,3days left ledger auction proceeds going currently 0 006 bitcoin getting sharing bidding
2019-05-24 16:50:04+00,Bitcoin Data Giant CoinMarketCap Sponsors Major Israeli Football Club
2019-05-27 11:56:09+00,Here another new feature worked nearly complete exchange page allow see value currency price order book coin list section shardax shard bitcoin cryptocurrency crypto blockchain
2019-05-27 08:28:57+00,BITCOIN BTC USD Point Technique Lundi 27 2019 BTCUSD graphique
2019-05-26 18:48:55+00,I still expect 9500 provide strong resistance But le I normally would happened 6k
2019-05-27 05:41:00+00,Meet GAMB Strategic Advisors GAMBproject Decentralization Blockchain ICO ecommerce eth btc marketplace disruptive
2019-05-27 10:10:17+00,We launching new listing promotion together Win 3 BTC 200 000 OCEAN total reward Details available KCS OCEAN BTC ETH CryptocurrencyNews cryptocurrency Crypto cryptocurrencies CryptoExchange cryptotrading
2019-05-27 11:57:10+00,New mining Hub relaunch NewYorkCoin Pool NYC BTC
2019-05-27 11:57:11+00,think best way accumulate bitcoin whole bitcoin expensive trying outsmart market reasising someone else already put someone el shoe someone else shoe
2019-05-27 11:57:12+00,Just perspective bought 1 BTC February many indicator daily chart cry Buy around 3600 went 25x long profit would 15 BTC 135 000 R R ratio 37 5 BTC crypto BItMEX
2019-05-27 11:57:13+00,Bitcoin culture minimize trust maximize verification Everything else opt nothing nothing le
2019-05-27 11:57:17+00,Bitcoin BTC Surges By 10 To Near 9 000
2019-05-27 11:57:19+00,fake twitter id livecoin cheating livecoin customer holding MXM asking deposit first 0 01 BTC 0 02 BTC address 1A7MZVBaaN9UwKPaGTcGtKrUHg2tsgHaqc resolve MXM swap issue beware handle
2019-05-27 11:57:25+00,Current Crypto Prices BTC 8720 08 USD ETH 266 15 USD LTC 113 86 USD BCH 432 54 USD XLM 0 1327 USD DOGE 0 003139 USD NEO 12 03 USD XRP 0 4092 USD CANN 0 001482 USD EMC2 0 1191 USD XMR 94 6 USD BTG 24 3 USD
2019-05-27 11:57:29+00,1 Bitcoin average price 8704 08367188 0 24 1h 2 Ethereum average price 266 20437813 0 38 1h 3 XRP average price 0 4089680098 0 27 1h 4 Bitcoin Cash average price 433 164538305 0 16 1h 5 Litecoin average price 113 53080966 0 29 1h
2019-05-27 11:57:14+00,USDT holding October 2018 Binance 832 M Tether 486 6 M Huobi 461 6 M USDT holding today Binance 550 M Tether 214 M Huobi 147 3 M Difference 868 9 M They getting rid USDT buy Bitcoin Not Tether keep printing 30 million USDT every day
2019-05-27 11:57:19+00,Dubbed Jewel airport park complex feature forest park walking trail seven storey waterfall 45 000 litre water cascade Full story mondaythoughts bitcoin EuropeanElectionResults godmc
2019-05-10 10:07:56+00,Bitcoin Is Somehow Still Climbing Forbes Bitcoin
2019-05-10 11:22:26+00,hahaha view industry everyone video interview
2019-05-26 20:10:27+00,Bitcoin Price Slays 8750 Hits 12 Month High Sudden Parabolic Swing
2019-05-27 11:57:31+00,Company innovative approach interesting road map ooobtc obx IEO exchange crypto bitcoin ethereum launchpad blockchain toqqn dogecoin Btk usdt Btcone OVC
2019-05-27 11:57:33+00,rand My problem I never know right time invest knew Bitcoin going go I pinpoint actually invest would recommend going finding right time invest
2019-05-27 11:57:33+00,LTC UsD sideways look weak LTC 40 since call 4 day ago I play LTC BTC right
2019-05-27 11:57:33+00,Bitcoin Price Analysis BTC Surging Trading Above 8 500 Will It Go Parabolic BitcoinBTCPrice
2019-05-27 11:57:34+00,Check latest update weekly update EOSBet BTC LTC iGaming
2019-05-27 11:57:36+00,Nice Airdrop aware
2019-05-27 11:57:36+00,Good project
2019-05-27 11:57:37+00,killer analysis always
2019-05-27 11:57:37+00,blockchain cryptocurrency bitcoin ethereum ICO P2PS P2PSF startup
2019-05-27 11:57:38+00,Block Number 578 021 Time 5 27 2019 11 56 20 AM UTC Miner F2Pool Transactions 2 640 Block Value 7 446 417 BTC Size 1 136 846 byte Total Supply 17 725 262 5 84 40601 BTC issued Price 8766 93
2019-05-27 11:57:39+00,ganna fomo accepting BTC hit 20k BTC
2019-05-27 11:57:41+00,The OOOBTC token serve driver platform valid exchange used across well known exchange It reusable ERC20 token freely transferable Ethereum blockchain obx crypto bitcoin ethereum blockchain btc toqqn
2019-05-27 11:57:41+00,Rado Looking history since 2011 July Be last chance grab BTC lower ever bull run always come 2 8 Months
2019-05-27 11:57:44+00,Agreed Storing work capital complex problem One could choose fiat money land Bitcoin silver etc work remain subject market flux Hence adage diversified portfolio
2019-05-27 02:50:53+00,100k 2019 still play citadellife
2019-05-11 14:30:30+00,Nice Work
2019-05-11 15:01:36+00,Kuy
2019-05-27 11:57:34+00,Bitcoin BTC v Litecoin LTC Price Analysis Bulls hold sway coin post significant gain Bitcoin Cryptocurrency PriceAnalysis Altcoins Analysis
2019-05-25 06:30:15+00,Investors trader AhrvoDEEX platform rewarded trading stock ETFs creating liquidity platform Crypto AI ICO TokenSale ETH BTC Ethereum bitcoin blockchain
2019-05-27 11:57:35+00,HODL Bitcoin Proves Itself Unlike Altcoins This Man Had Lost Almost 50 BTC From Investing 50 Different Altcoins In 2017 Cryptocurrency CryptoNews
2019-05-27 11:57:52+00,Why Facebook launching cryptocurrency rival bitcoin fintech
2019-05-27 11:57:54+00,Bitcoin zet opmars voort klimt richting 9 000 dollar
2019-05-27 11:57:59+00,Nuovo post Bitcoin News Litecoin Sfonda Il Mura Dei 100 Euro Bitcoin Blockchain Ethereum
2019-05-27 11:58:01+00,bitcoin mining programm Binance
2019-05-27 11:58:03+00,HODL Bitcoin Proves Itself Unlike Altcoins This Man Had Lost Almost 50 BTC From Investing 50 Different Altcoins In 2017
2019-05-27 11:58:08+00,So insane mex funding longs paying short eth Btc Probably lot people flipped short get funding 2 min Sure would suck pamped right
2019-05-27 11:58:08+00,Cryptocurrency market update Bitcoin come close 9000
2019-05-27 11:58:11+00,FREE Ethereum game blockchain Bitcoin crypto cryptocurrency bitcoins Eth eth token Litecoin coinmasterGame coin
2019-05-06 05:41:00+00,OMGFIN Announced Upcoming Launch IEO Platform OMGFIN IEO First IEO platform support XRP IEO XRP USDT XRP1 news xrpcommmunity xrparmy ripplenews launchpad bitcoin XRP
2019-05-27 11:58:14+00,Bitcoin Blockchain BlockchainIsTheFuture Hashgraph Cryptocurrency DistributedLedgerTechnology
2019-05-27 11:58:15+00,Bitcoin Price Backs Off 12 Month Highs But Bias Remains Bullish
2019-05-27 11:58:15+00,blockchain cryptocurrency bitcoin ethereum ICO P2PS P2PSF startup
2019-05-27 11:58:15+00,taseer I think Pakistan legal invest Bitcoin
2019-05-27 11:58:17+00,bitcoin btc crypto bitcoinnvestment Starting From 50 usd Up 3 Daily Profit Until It Doubles Your Investment Sign Up Here
2019-05-27 11:58:19+00,QuarkChain QKC Blockchain Chain
2019-05-27 11:58:44+00,Rezeau
2019-05-27 11:45:22+00,Bitcoin BTC Whales Making Splash Did 9 Transactions Valued 236m Spark Market Bitcoin News bitcoin market Whales
2019-05-27 11:58:23+00,The Top 5 Countries Gripped Bitcoin FOMO Right Now
2019-05-27 11:58:23+00,EPUB Download Free Digital Gold Bitcoin Inside Story Misfits Millionaires Trying Reinvent Money gt gt
2019-05-16 12:05:15+00,Want earn free token Hurry Up Bounty live Follow link bounty group FreeTokens LOL Bounty BlockChain SecurityToken Education OnlineEducation Ethereum Eth Mew Btc AI MachineLearning DPT
2019-05-20 02:04:39+00,lnbc200u1pwwyf69pp5js3nlqrdxx974qp4z2apm973mte354tmzlvsthct9h69pn4ax4ssdqu2askcmr9wssx7e3q2dshgmmndp5scqzysxqrrss8c0erl289830h7p8vuqx933tcrza0tmz92pj4mlwft6lujvnjx5pnlsh9t5kkzgpjckxffug4hjkv6akgavrg23vshzz0h92l2yapdqqt3jce6
2019-05-20 22:56:26+00,BITCOIN GIVEAWAY TIME 75 BTC 3 lucky winner To enter simply Follow Sign Like retweet Tag 2 friend Winner announced 5 27 Twitter
2019-05-26 14:07:13+00,218 000 Bitcoin next bull run January 2021 Price prediction many cryptocurrencies including Ethereum ETH BitcoinCash BCH Litecoin EOS Stellar Lumens Cardano
2019-05-27 11:58:32+00,Current Crypto Prices BTC 8721 52 USD ETH 266 33 USD LTC 114 03 USD BCH 432 68 USD XLM 0 1327 USD DOGE 0 00314 USD NEO 12 03 USD XRP 0 4093 USD CANN 0 001483 USD EMC2 0 119 USD XMR 94 6 USD BTG 24 3 USD
2019-05-27 11:58:36+00,Performance year Bitcoin 130 Oil 29 NASDAQ 15 S amp P 500 13 Dow Jones 10 FTSE 100 8 Nikkei 6 Gold 0 8
2019-05-27 11:58:40+00,Over year I tried many successful disastrous ICO project ETH BTC P2PS
2019-05-27 11:58:41+00,Newsbtc The past 12 hour blur crypto asset market In matter hour Bitcoin BTC rushed passed key resistance level 8 000 8 400 Read
2019-05-27 07:29:44+00,2018 2019 nutshell 1 Alts dump 2 Influencers like ReaDDYy fOR pump 3 BTC pump 4 Influencers like ReaDDYy fOR pump 5 Alts BTC anything 6 Influencers like ReaDDYy fOR pump Never change Twitter never change
2019-05-27 11:58:47+00,Unless I missing something I see bitcoin long grind past
2019-05-26 20:45:00+00,slatecurrency Trading HitBTC SLX BTC amp SLX USDT Trading Pairs NOW available HitBTC blockchain btc eth disruptive decentralized ico dash masternodes entertainment streaming SLX
2019-05-16 11:21:44+00,coinmarketcap IOTA 24h Vol 62M USD 5 IOTA marketcap BTC 24h Vol 33B USD 24 BTC mc ETH 24h Vol 16 3B USD 61 ETH mc LTC 24h Vol 6 7B USD 114 LTC mc Compare bullrun 2018 think happen volume kick IOTAstrong
2019-05-27 11:58:52+00,Tradecipher make professional crypto investment easy Get 1 Year Goldlight Crypto Research 119 A Chance Win 0 1 Bitcoin 390 joining TradecipherCrypto Waitlist
2019-05-27 11:58:53+00,One dollar bitcoin
2019-05-27 11:58:55+00,BTC Support update 8k 8200
2019-05-27 11:59:00+00,Chain QKC BTC
2019-05-27 11:58:57+00,This week Craig Wright file Bitcoin registration US Copyright Office Facebook launch Global Coin 2020 USD stablecoins reach record market cap Weekly Hodler Digest
2019-05-27 11:59:07+00,blockchain cryptocurrency bitcoin ethereum ICO P2PS P2PSF startup
2019-05-27 11:59:07+00,Spoon Bitcoin culture minimize trust maximize verification Everything else opt nothing nothing le
2017-09-08 15:45:33+00,How China Sinks Bitcoin Probably happened today lol
2019-05-27 11:59:09+00,I live start intellectually challenged people continue compare XRP TO BTC immediately compare XRP BTC
2019-05-27 11:59:09+00,ooobtc obx crypto bitcoin ethereum blockchain btc toqqn
2019-05-27 11:59:10+00,I mean broken clock right twice day Alts pump point BTC much better hold So unless predict future know get alt night well stick BTC
2019-05-27 11:59:01+00,PNTV Green Leaf Farms The Argentine Province Jujuy Announce wsj nytimes reuters bloomberg thestreet forbes nasdaq IHub StockPosts newyork business cnn bet foxnews bitcoin blockchain crypto cannabis marijuana CBD Dispensary
2019-05-12 13:23:52+00,My 2 5 year old learning alphabet B Bitcoin
2019-05-16 09:55:30+00,Bitcoin fee increased almost 8 000 since january Digital Gold Maybe Digital money replacing costly credit card Nope Microtransactions Nope No Fee IOTA BTC IOTA IOTAstrong
2019-05-27 11:59:14+00,
